response_post,level
"Sometimes, when something happens in the moment, we see it as this huge thing because it is the center of our focus. It is only once those moments pass that we can look back and connect the dots to see that it really wasn't such a big deal. So my advice is this: As you look forward, remember that in the past the dots have always connected correctly, and have faith that those dots will connect the way they need to again. People often ask me why I don't worry about these seemingly huge problems in my life. Well, it's not that I don't worry, because I do. That's just being human, but I constantly remind myself that things usually just work out, and I just need to run the course that I see in front of me. So follow the course, stay on track, and when little problems feel like mountains in front of you, have faith that the dots will connect, and you will come out the other side as a stronger person. Good luck, my friend.",1
LOL I feel like this every fucking day. No matter how good the situation is I always know that not shit and ever be to myself or anybody and happiness is only temporary. definitely not alone.,1
"I can't possibly step inside your mind right now and know the right thing to say, but I'm just here to say that being alive is the most, only meaningful thing in the universe. The Stars wouldn't be beautiful or bright if there were no eyes to see them. The universe is so big it is easy to feel like a speck, but there is a universe *inside* you as well and you have the power to create one, you are so much more than a speck, you are a light that's the only metaphor I can think of but it doesn't quite capture it",1
"I feel ruined my birthday, my daughters, my fathers birthday, and now Christmas. your track record for this year? I fucking hate it. such a god damn asshole ruining every holiday. But I ever get better it seems.",1
Where does self exile exist as I never found it,0
Why would you want them to?,0
"Yes, you are not alone. Do you feel guilt or shame - what I mean by that is do you feel like you don't deserve that 1 day of feeling OK? It feels so easy to slip back because it's comfortable, right? It's familiar and easy. Kudos to you for being able to have good days! YOU SHOULD BE EXCITED! Keep enjoying those good days and there will begin to be more and more.",1
"I feel you, I'm in the same situation. My depression and anxiety is just good enough for me to be in uni or work, but never good enough for me to keep the job or do good in school.",1
"No. The people who love you will feel some measure of pain for the rest of their lives. I know that wasn't the kind of pain you were asking about, but yeah, there's always going to be pain for someone I'm afraid.",0
"Sometimes having friends isn't about them liking you, but rather that you like things that other people do. Like if you are really into something, say cars, than if you have a car and go to car meets or race, others will see this and know that you're the guy to know if they want to get into a car scene. Another example would be if you are really into books and people feel like reading something and know that you are into books, they might come to you for recommendations. Most friends bond over a subject before they ever get to know each other as anything more than people interested in the same thing.",0
Im a woman and i know i get along better with men. Ones who arent trying to screw me and forget me anyway. Women in general like to talk talk talk. If thats all youre looking for (at least to start) most of them would chat with you.,0
That may be the case but seems like practicing stoicism is also option to have a supposed happy life I know about you but for me to realized that every little thing that I worry about is just so small to the rest of the world that I help myself but to chuckle I expect anything good to happen to me from now on and all these minor inconviences will eventually end at some point So why bother worrying about it?,0
It did nothing for me me though l was misdiagnosed - l'm actually bipolar. I was on it for around two years in total. I remember that it had very few side effects.,1
"For me, I knew something was wrong when I had my first breakdown. I used to tell myself that I was tired or just lazy because I couldn't get things done. In actual fact, I had no motivation left in me. However, after that episode, it got worse for me because I felt all alone as I had no one to confide to, especially when my first breakdown was in front of my family.",1
We may need to hear the content of the conversation. Just saying something like was seem very convincing. Perhaps think I should try antidepressants like to see a Dr for my depression and see if benefit from,0
"I'm sorry you're feeling like that. I know it sounds grim as fuck, but if you broke the record for suicidal thoughts? It also means you've broken the record for resisting suicidal thoughts, and that's something to be proud of - even if it doesn't feel like it just now",1
Your fiance is a bumface for not remembering. Get a new one. Happy birthday,0
"Well, is moved into a new home a few months ago, befor that i always had to walk 30 - 60 minutes to get where ever i had to go (sschool, work, train station and so on). Everyone was always so confused why i liked to walk the whole way, even if someone would offer me to drive to work,s chool, or back home again. I just liked to put my headphones on, listen to music, and let my thoughts just flow. I HAD to go from A to B, so i wouldn't worry about something i still have to do, because i could do nothing while i had to walk from A to B. I could just disconnect from my life for a while. And it always felt great. Dont get me wrong, all the bad thoughts, the bad emotions and feelings weren't gone, but it was just different, in a beautiful way. It seems like sometimes we have to force our mind to get some rest in a way or another.",0
"I know the feeling. It sucks. But maybe now when you had even short moment of relief, maybe even happiness, you know it's possible to feel that way and you can try to get energy from that. Hope it doesn't sound stupid. Stay strong.",1
"what are you needing help with? part of the problem with anti depressents is how easily and flippantly they are prescribed. There is use for these medications but should be far more proper professional analysis before determining the correct meds, and monitoring. Lack of health care support means throwing the most widely used ones at a patient, refer a psych and hope for the best. They are not terrible, can help in many people but take so long to be effective and are hit and miss so its a tough solution when in a present difficult crisis. Sometimes doctors will prescribe short term assistance like Benzos and tranquilizers to keep stable in the short term, I found this works better for me than long term anti-depressents.",1
"Ambien, xanax, cough syrup, a handful of muscle relaxers. Drinking alcohol keeps me awake. Zzquil and melatonin do nothing for me.",1
I hope that letting that out can put you at some peace.,1
"I'm so sorry you're going through this.. My dog passed away two months ago so I know how painful it is :( I adopted another dog, I was still upset but it definitely helped me with the grieving process.",1
"There must be something making you feeling this way mate, you just gotta identify it.",0
I can't make any promises :P But I'm up so I'll try to help. What's up?,1
"I understand, and our current society help. Would you like to chat, I know hard to find someone who you can express with so if you want that here.",1
Hi Jaret. Please confirm to me that you are not Jaret from Bowling for Soup. Then please tell us a bit more. We'd love to hear and to talk with you.,1
"What would you like to do? Hugs, hope things become better for you soon! :)",1
"That is actually true. It is not going to be easy. Sometimes you will feel down, like not achieving anything. Sometimes you feel like you are in the road you want to be. But all up to you. You are not alone in this road. Everyone goes through same shit.",1
"I hear this all the time but I don't really understand what it's getting at. I remember one context in which it made sense but that was a fantasy novel. The novel is Pillars of Creation, part of the Sword of Truth series. One of the characters belongs to a cult which believes that all people are evil, using this belief to justify many atrocious crimes. He tells a woman that he loves her but she rejects him, saying that he doesn't know what love is and that he doesn't even love himself. I felt that made sense because in his case, it would basically be a completely foreign concept.",0
I'm drowning too. Everyday. It easy to take shit for granted. I never thought my life would get worse. I thought I was invincible but life fucks you up in so many ways. You need to find some inspirational music and listen to it a lot. Maybe make a goal for something. I know it all seems futile but little things sometimes help. But I know how hard it can be. When you're caught under those dark deep waves. Surrounded by onlookers on their cruise. It's easy to say fuck it but you deserve to be happy.. I hope u can find something that helps you through this darkness.,1
So sorry for your loss,1
"Please call a crisis counselor ASAP. Call your own therapist if you have one, let their answering service know you are in severe crisis, or head to the nearest ER and tell them you are having a mental health crisis. There are other ways to deal with this besides suicide. I have been there. Things have gotten better. I do struggle with at least a few things every day but not the way I do during what I call a crisis. I'm actually in a small crisis state right now, which led me to this board and trying to do the things my therapist has given me to do in the past like up my seroquel and ativan and rest as much as possble for a few days.",1
so sorry hurting so much. here.,1
"When you start alternating the shops where you buy your booze in order to hide your problem from the cashiers (not sure it's the right word, I'm French), you're pretty far gone.",0
I'm locked in a viscous cycle between my physical and mental illnesses. Been diagnosed with major depressive disorder for close to 5 years now. About 2 years ago I developed a movement disorder. It has been documented but not yet diagnosed as doctors haven't figured out anything about it. The depression triggers the non epileptic seizures which cause major disturbances in my life. Crippling my quality of life and reducing what I can do. This feeds into my depression. More negative mental health the worse and more frequent the seizure like symptoms happen. Also have bad tremors and ticks in relation to the non epileptic seizures. I often fall down and have issues walking and standing. Can barely leave my home. Am reduces to limit movement inside my home which has caused weight gain from decrease movements which also stregnthens my depression which in return causes more seizure like episodes. No medication helps my mental or physical health. It actually worsens both. I am going without treatment because doctors refuse to take it seriously or are completely dumbfounded. It has been over a year since anything was prescribed to attempt to help me. Seen several specialist. This terrible cycle has lead me to multiple suicide attempts in the last few months.,1
"There are people, who want to know more if you don't fake it.. but some people are not worth knowing your secrets.. so just don't mind them, smile and move on. However, it can become stressful if you have nobody to talk to in a realistic way as possible without anything fake at all on you. With people, where you can toss that mask away for a moment and just be that negative little cunt for a moment lol.. we all need it sometimes.",1
"you are not alone, no live no friends no job. I graduated with 3.8 out of 4.0 from engineering college, I worked very hard after that nobody want to hire me.College is shit. now I stay home 24/7 literally nothing to do. I live with my parents, 23 years old. I want to die now. I am crying all the time, I don't know why I am here.Live is suck",1
I use to be miserable. I hated my wife. My life. Lots of stuff. But one day I just Decided to be happy. I got up. Told by bitch wife I loved her. Kissed her. Got up and sang in the shower. But i was miserable again in an hour. But then the next day i tried again. And the next afternoon. Again and again. Finally my wife wasnt a bitch anymore. My life wasnt so bad. I realized being miserable can be a choice. Our emotions can be changed by our actions. Wake up and just pretend to be happy. Pretend you like your job. Fail and do it again.,0
"Sometimes, I feel like this is okay though. The not being okay. I think there's this expectation we all have just because everyone else and everything around us shows this picture perfect life that is normal. Also, I get to the opinion sometimes that when none of it matters, it's actually the most liberating, because then I am truly free of my worldly concerns. I don't know. Silver lining and framing and all that jazz. Best of luck, friend.",1
"For me, it's the number of times I say, I hate my life and I hate people.",0
Yes! Dating can get you out of depression. Not without medical attention though. I'd tell from the get go,1
I went to counseling yesterday and the counselor confirmed it. All I could think when I walked out of her office was ...fuck. I'm mentally ill?. I thought I was just being me my whole life and I'm still in extreme disbelief.,1
"I know it's obvious but don't ween too quickly. I don't know your drug but from my experience, I was fine until I got too cocky and lowered my dose way too quickly. I got sick, anxious, depressed, I threw up a few times. It sucked so just stay safe.",1
Same. And somehow I always trick myself into believing I'll find it some day. How fucking naive am i.,1
Why do you crave this attention?,0
I'm sorry you feel this way. Is there anything in particular that's bothering you?,1
Some days I go the whole day without even knowing what day it is. And fuck I hate weekends.,1
"The most important thing in a person is will. Nothing happens to or for people without the will to MAKE things happen. So change things. Otherwise, you really can't complain about em.",0
"The only part of your life you get to experience is the present, and you gotta set aside some of that experience for the future. The past will always be happier or sadder because you have to recreate it every time and it gets a bit more distorted every time.",0
"just a stranger on the internet, but not alone. here to listen.",1
"I'd say that they choose to endure it... It's just that they have a more hopeful insight, they can fully understand something good will happen from their work, and they can grasp that it's real. That's why I sometimes wonder if Depression is stunted cognition (maybe imagination), because if I could imagine the beauty that life has to offer I'm sure that no matter what got in my way I'd plow through. Why would neurotypicals work so hard if they couldn't in some way see the other side, feel it, almost experiencing it? I just think we're unable to do that.",0
It really does suck... Just waiting for an accident to happen or to finally snap and actually do something.,1
If you're ever feeling really down and feel you have nobody to talk to always call a help line. Plus what even if calling does nothing it's first occupied you for some time so that you don't do anything else and secondly it's better then not even bothering to call at all. Please call a help line and trust me it's what you need to do right now.,1
"Yeah, I just feel like, I don't care at all. But I know people are missing me at home when I'm stuck here studying for my finals but honestly I like it here, alone. In fact, I've decided not to answer any phone calls from my family because I just want to vanish from their attention.",1
That's not the real you. It just feels more comfortable but it's not. I hope you can see that. Stay strong friend.,1
"Yeah man I can relate. Especially with the crying and screaming thing. I wonder what's stopping us from crying? And what's worse is I've even had friends comment on how I don't get upset easily or mad about certain things that are usually normal to be mad about. But how can I if I don't even feel like I'm a real human being, yah know? I wish we could escape the void inside ourselves.",1
"I'm so glad you're happy! It's nice to see happy people :) Also, happy birthday! Hopefully your day turns/turned out well!",1
I like poems (but the ones I write are bad). Do you have any more you want to share with the world?,0
Good question I would like to know to,0
"Trust me, don't do it. I have a scar on my left arm where I cut really deep and it gives me anxiety from people seeing it and depresses my mood looking at it. Doesn't help that I'm in fucking GCSEs either, but anyway I'm rambling. I know you wanna see blood; that's how I was too. But just don't, for me.",1
"I was thinking the same thing like a minute ago. It's kinda reassuring to know I won't have the courage to take my own life, but I'm scared at the thought of what if I'll find the courage? honestly.",1
"My ex used to feel like this, as did I (we both had problems) and the best we could do was talk and be completely honest on where we stood with things like this. I hope he doesn't leave just because he maybe feels overwhelmed. But I've been on both ends, and felt a burden as well, so you aren't alone on that. I really do hope things work out. If you ever need a PM buddy, I have a pretty free schedule and am always looking for more pen pals, and possibly more friends.",1
Test mean literllery nothing. in like 3 years you proballey wont even remember that test,1
Could you tell us more? visiting my hometown too and I kind of have an... uneasy feeling with it too. Feels like I achieved anything since I left home and is still the same weak and shy little guy. But at the same time I also grew estranged with my hometown and my friends and family over here. Idk if that even made any sense but hey have an internet hug buddy the least I could do,1
"All meaning is made up. Maybe find solace in the fact you are just valuable/invaluable as anything else: Doves, cows, trees, minerals, other humans, stars. Try to see what about your life you hate so much, specifics, and try to change those things. PLay with things you are scared to do, do things that will make you feel better about yourself and your life, read positive mantras, read books that make your mental concept of the world expand. Force yourself onto new experiences. I think with time one's self loathing can be softened. After all the self loathing didnt come from you but from other's, from the environment. Babies dont hate themselves.",0
"Hey, what grade are you in? 29 and I have felt that way many many times especially when I was going through school. Negativity is temporary I promise you. Honestly high school is just a blip on the radar for you I swear. It feel like it now but damn are you going to feel good when you persevere. And you will persevere I promise you, I promise you that you can do it. If you need someone to talk to feel free to message me if you are comfortable. I grew up in a dirty and chaotic home with cat shit behind the couches and the TV and everything smelled bad,all the clothes smelled like mildew and my parents were upset and angry all the time and there were drugs involved and I was overweight and nobody was helping and yada yada yada and I just want you to know that no matter how bad it gets, you build a unique strength that no one else can even touch upon just by making it day by day. Your experience, is one that I understand I promise you and you are going to come out of this a bad ass. I promise you can do it",1
"I feel that way, but somehow I always manage to lose even more if someone insults me, so clearly I've got some buried somewhere. I wish I could just have no self-esteem, so that I could get that insult immunity, but nope, whenever I think I'm out I find more to lose.",1
It's the last thing I'll do. But I have too much to do first.,0
"I'm really sorry you're feeling this way. A person can be cared for by dozens and still feel alone, depression is a monster. I hope you're able to make progress against it in your own way, or by talking to people you trust, living the life you want to live, or by obtaining professional help. Please send me a message if you would like to talk to someone privately.",1
"I'm in the same boat, if I do get drunk it's not the fun kind it's more like all those depressing thoughts start boiling over. I don't drink liquor anymore for that reason, now I stick to a few beers every night and that's usually enough to help me relax.",1
"Everybody has a thing for 10s tho, numeral ratings for people are dumb anyways. If you get to know people you can develop feelings for them not only based on physical appearance or even find out after all they're not that attractive in the end. Granted it plays a huge part initially and people who say otherwise are hypocrits but yeah it doesn't just stop there. But still, I am ugly and I hate myself haha",0
"Only you can answer the question. I personally find video game is a good way to enjoy my life. Though I agree that the hamster wheel and rat-race pretty sucks, but I just don't see much alternative at this point if I want to keep doing what I do now...",1
You asking for reasons is the biggest reason of all.,0
"I started this a little while ago too. Don't do it often, once every few months or so when I get really worked up and I start losing myself. Thing is, I like it. Not in a weird kinky way lmao but like, man it just gets me so revved up ya know? Like after I feed myself a few shots with each hand and I can feel the side of my face starting to swell up I feel like I can take on the fucking world head on. It's something that has actually made me heavily consider taking up boxing because it's win win. I get to punch something AND I get to get punched in the face back.",1
"I feel this way too. For me, it's a strange feeling because I'm constantly on the verge of the tears but if I try and let myself cry, I can't.",1
"You have done your best, and therefore this cannot be called failing! No matter how long you have managed to abstain from self-harm, this is an achievement that no one can take away from you. You have learnt ways to cope and live life without self-harming because you did it for four Therefore, you are starting with more knowledge than you had when you stopped self-harming for the first time.",1
"Yeah I'm working a PSW job and it pains me to see these people who are forced to or even worse don't have anything to do but lay in bed. You see the effects of social isolation and the lack of control. I work with a person with ABI and as much he tries to stay positive, the frustration seeps out of him all the time. The little things we take for granted like going to the bank, buying groceries, picking up prescriptions become so regulated and standardized in their lives, that you can't expect any other reaction but frustration. It's affected my personal life with my relatives because I get so angry thinking about how there is no way to make them better and I lash out for the littlest reasons on them. I understand it's all about perspective but in the already depressed state I'm in, I know I'm not cut out to help other people feel better. Putting in my 2 weeks on April 16th, and heading back to school in May. I can't keep working there, it's making me much more emotional than when I started.",1
"Hard to end the spiral. Like the post above says, find out where you can break the feedback loops and go little by little.",0
"No one deserves to be alone. You sound like you're going through a hard time. I am, too, but lately I've been feeling more confident and hopeful. What's bothering you? You seen like you might think you'll be alone forever.",1
"I have major issues with sleeping too much. I can't sleep when I want to at night and then I sleep all day. I set an alarm to wake me up at 12 and usually snooze it for an hour. If I turn it off then I don't get up until 4PM. I can't say I get any sort of fog feeling though, just incredibly tired.",1
Me too..depression clouds our judgment. It gets really hard to think about things clearly. Hate this feeling but it won't go away yet.,1
its not about her as such its more so like the fact i tried again and failed. but you know i hate swallowing pills so i doubt ill be able to swallow enough to kill me. I am up to about 11 so far,0
"a cool way of looking at it, I have never felt that way but I hope I can one day. Cheers!",0
"I never go to class. It sucks how badly my depression, anxiety and PTSD ruin my motivation to even get out of bed....",1
"Chemical imbalance in your brain, its alright , happened a lot of time for a lot of people",1
like what . eat bananas i heard it can make the person little happy,0
"Same. Was feeling good a few weeks ago after dealing through a rough break up but then life hits you sometimes and it fucking sucks. I hope you're doing well, OP. If you'll ever need somebody I'm just a chat away",1
Hopefully he's a nice guy and doesn't punch you,1
