response_post,level
"That's pretty vague, do you not know what you're doing in regards to a specific section of your life? Like school or work?",0
"idk what a Red pill means exactly but my advice to you is if she treating you right then fuck her there are billions of other girls out there, and if u feel like in love with her and just leave her then try to not care and you have to accept the fact that some girls(as well as some guys) will lie straight to your face for years without any remorse. my advice is stop caring before too late.",0
"I think it's social anxiety , that creates paranoid feelings , unless I'm wrong but that's how I feel",1
"By any chance do you think you're in a loop. Junk food can make you depressed. And being depressed probably makes you eat more junk food? For a while that was my problem too. Even if its just random, ill probably binge and feel bad later. Only to indulge in more later to try to cheer up.",1
"depression. not sadness which is caused by something and is healthy. Depression is an actual mental disorder which commonly goes untreated. The best things you can do for depression is first of all, not hiding it, tell your loved ones so they can help you. also get a therapist, very helpful and help you cope with depression and get over it. If you think really bad you can see a doctor and see if medication is a good idea. I take antidepressants and my depression is gone, it change you like I originally thought it would, it just makes me the same but not sad all the time.",1
That's why I'm repeating 11th grade. It sucks.,0
"Ask your school counselor what resources they can give you. Just go into the office, ask for the counselor, and see what they've got.",0
Is that really so bad? Maybe it was the smart decision because you needed that time to read recover. You're being kind to yourself when you need it and that's important. Hope you feel better soon.,1
Why can't you get a job as a lawyer?,0
"I don't want you to jump. I don't want you to die, in either one. I don't know exactly what you're going through but from the sounds of it, I'd suggest focusing on the parts in your life that you enjoy.",1
"It's not uncommon. Bipolar can be very difficult to diagnose. We tend to think of it as a constant swinging between high and low but really you can be low all the time and still be bipolar if you had one high at some point. What you do is move forward with your new diagnosis and work on treatment and coping skills. ADHD and depression are generally easier to manage long term than bipolar disorder, so that's a plus.",0
Expecting people to stop being depressed like turning off a light is extremely stupid.,0
"sorry to hear that, but been in a similar situation after taking some time off of school. My best advice is to take the minimum amount of classes possible so you get too overwhelmed. For me essential to plan my assignments in advance, so that I can just do things one by one and not let it all get piled up cuz then I wanna die. Also, if you need a break, take one. School will always be there but good to take care of yourself too :)",1
"The generic answers heard over the years tend to go something like the following; exercise, sunlight, talking, therapy, stroking animals, eating healthily, meditation and writing one thing thankful for daily. I say with sincerity that any of those have worked for me but helped others. Keeping busy with hobbies on the days able to function might help. It does slightly for me.",1
"Hey, just wait it out. I know what you feel. Sometimes I think I'm attractive, and sometimes I can't even look at myself I'm so disgusted. I've come to realize it's all just a fucked up mind game I play with myself. I doubt you're actually that ugly, you're probably kinda cute honestly, but if you're anything like me, you've tricked yourself into thinking you're ugly. If you want people to want to be around you, you have to do some basic things like showering, putting on actual clothes, smiling, excercising a little and pretending you have confidence. It's honestly dumb, but these things can be hard to do, especially if you struggle with low confidence and depression. But if you take care of yourself, it's not too hard to find people. And just you wait until you find a person to kiss on New Years, because the feeling is worth the wait. I know this is all a bit corny, but if you ever wanna talk about anything I'd be more than happy to :)",1
No amount of 'you are not alone's from internet randos who won't reach out to you after will help. My local mental health system is an absolute joke and often made me more suicidal. So I also am alone when in crisis.,1
at least you got people trying to comfort you. I even dont have that. Again there are people who got it Much worse,1
"Does there need to be a reason? Depression is an illness, and like any other illness it doesn't need some form of justification, it just *is*",0
"You're a good man, Median. I hope you know this. I hope that you have people around you that will tell your story for centuries, and that you live on as a hero in the minds of newer generations. But, I'd rather you live, personally.",1
"Thats totally normal, most people get that from time to time. It will pass, the when is the real question. Good news is you can work on the when, at least it works for me. I think the key is to accept whatever you are feeling, not fight it and not try to change it, even try to get yourself to cry. The point is really to change your mindset from 'i have depression i can't cure it, it is killing me' to 'i'm sad again for no reason, human brain is a pile of shit and buggy as hell, I'm gonny cry all day to give it what it wants'..",1
Yes you are right from my experience.Not dealing with my problems. I isolated my family. It just came second nature.When they don't understand me.I kept busy on the shitty computer to avoid my problems. I realize that the worst thing i could have done. I need to try harder and put my family first who means everything to me.,1
I don't really think life is he'll but I don't understand the weird sadness or fear of death that people have. I've known a few people who died. I wasn't sad at all. Everyone I know is going to die and one day I am going to die. Why is that sad?,1
"No friends here, willing to listen. Need someone to listen to me sometime too. I'm going to bed right now, but if you want to message me I will get back to you tomorrow.",1
"ive just sat in my room crying my eyes out thinking mostly about this. Conversations with people ive known my whole life i find difficult, its not natural. Everything feels so forced! im sick of trying so so hard to look normal. I hide my feelings from absolutely everyone and im exhausted. No motivation in life, feel like im a waste of skin",1
"Omgosh. I just want to validate this feeling because I have been there. That said, if it's a matter of safety, there is no question. You know that you need to go. You just do it. It's not some kind of failure. You are taking care of yourself. It DOES super suck though. Don't let anyone tell you it's all fine and fun to go through that. I've been there. I've come out the other end and been okay for long periods too though so I mean, it doesn't stay like that. Hang on. It gets better.",1
Write here one good memory of something nice happened recently.,0
What were you taking before vs what are you taking now? Are you being prescribed by your general doctor or a psychiatrist? Do you feel like you are in danger right now?,0
"I'm down in that hole. Don't get sucked in is my advice. You'll get nothing good out of it. The thing with alcohol is that, once you start drinking too much, too often, the idea that it makes you feel better is entertained while it is not true at all. It's: *I drink to forget, but I've drank so much I don't know what it is I have to forget. So I drink, just to be sure.* Alcohol and drugs have become a habit for me and I can't really live without them anymore. I need them to maintain a level of tolerable shittiness - but trust me, I'd be way less miserable if I never started it.",1
"Thought I was ok and it passed away for half a year, but now it is coming back, and it hits twice as bad as before.",1
"Get up and take a shower, and then go for a walk so you can clear your mind. That usually helps me after going through one of these periods. It sucks, but you'll get through it. And don't lose your job, you don't want to end up on the street. You're stronger than you think, there's just a cloud of depression around you that's obscuring your vision. Stay strong and don't give up. You can do this.",1
well not for nothing but you made it extremely difficult to read your post by only using a period in the title. JUST saying not judging.,0
i used to. rn im in the area of not going to sleep so tmrw doesn't come,1
I mean fastest way is a pawnshop or trading stuff into GameStop,0
"If I had any will to do something good, I'd be doing it.",0
"Okay, so feeling shitty is necessarily a shitty feeling. But, even subconscious you is empathetic and cares about others, which is a beautiful fuckin' thing to be. It's why you have the capacity to feel so bad, and it's also why you can (if you want to) be an amazing resource for people. Being able to feel things as deeply as you or I can is something to be cherished and protected and put to good use. The world could use more empathy, you know? It's okay to hate yourself too, btw. Just be honest with yourself about your good traits as well, yeah? &lt;3",0
"Each day repeats with the only change is it gets worse, preach man.",0
"Pain's pain. There's no point in comparing our suffering to someone else's. Depression doesn't demand that you have a good reason. On a surface level, there's a lot about my life that people would even be jealous of, but that doesn't make me any less miserable. You're the only one living your own experience, no one else can say whether or not it warrants pain. If you feel something, you feel something",0
"Treat yourself to some body lotion, chocolate icecream and maybe a glass of wine while you're at it. Couldn't ask for a more relaxing weekend than that.",0
"I care, man. Hang in there, things will get better eventually.",1
"Dude. broken my arm so bad that I needed a titanium rod. I was in hospital for 5 days. Let me tell you that it was the most depressing and humiliating thing ever. I was in a ward with a man who was dying from pancreatic cancer and another one who was about to have his legs amputated because of diabetes. It is absolutely miserable seeing them alone throughout the entire day waiting for a visit and sometimes they have anyone come over at all. Furthermore, the medical staff were stretched so thin that I had to scream and bear unspeakable pain for 45 minutes before I could get my shot of painkillers. This was after they had attached the rods to my arm. Oh and last but not least, absolutely humiliating to use the restroom or shower. I understand and appreciate the efforts the medical staff commit but I really help but feel embarrassed when they shower me or escort me to the restroom. wish to be admitted to the hospital. EVER.",1
Mine is coming up and I am generally indifferent to it. I told my family I don't want to do anything for it.,1
Congrats on your birthday. I've never thought as well that i might see my HS graduation this year.,1
Maybe one day things will become brighter for you to see it in a better light so that dream job might be ideal,1
How did the trauma come about?,0
I hope you're still here. It gets better.,1
"If there's one thing I regret not doing, it's that I didn't kill myself when I was 12 and actually attempted it. It's been all downhill in the 15 years since.",1
a motorcycle ride sounds super cool. i can't even force myself on my bike.,0
I'm trying to increase my self worth so I stop doing this exact thing. My frustration immediately gets taken out on the one thing I seem to hate the most: me. I've started to set small goals for myself every day so each day feels like a success when I achieve those goals. This has led me to branch out and actually put myself out there. In doing so I'm discovering a passion for mental health advocacy and rekindling a love for doing creative stuff. I'm not saying everything has immediately gotten better. Holy shit it hasn't. But this helps at least a little for me! Hope you can find omething that works for you. Let me know if you wanna talk about it,1
The good is worth it! Hang in there! You can get through this because you're stronger than this! You can make it through cause the good will be worth it! Lots of love!,1
i guess the idea is that have something strong enough to motivate you towards it. I personally have goals but I never have so I really help you here.,0
What does that mean in practice? Are you one of those persons who got tired of being used so now you use others?,0
Please know that someone out there cares for you and would be heartbroken if you here.,1
"When I read this, I had to think of a girl in our company. I saw her like 2-3 days a week, always with a sad face. So, one day I just asked her, if everything is allright. She said Yes, of course, thanks. How about you? I answered with I'm fine. But I don't believe you. If you're ok, why can't you smile for just... one moment? She said: ... I never knew, that it was that obviously. No one ever told me that. I answered: I guess plenty of people know that something isn't ok with you, but most people just care about their own shit or just don't know what to say. If you wanna talk... I'm here. She ended the dialouge with Thank you.... And she never wrote me again since then. I felt bad somehow. On the one hand, I just wanted to help, but she refused it somehow or I scared her too much. On the other hand... maybe I just made it worse for her, and that's of course not what I wanted. The human mind is a thing, no one can explain. It's infinite.",1
Weed make my sorrow funny,0
"He's laughing at all of us, that sick fuck.",0
"No time to find link right now, but Sarah Silverman said exactly this in her interview with Terry Gross on Fresh Air a few months ago.",1
"I was like this at 16-18 all I wanted to do was sit in front of my computer and not leave the house. It wasn't like I was actually doing anything productive but on youtube / games I was just rotting and completely ok with it because it stopped me feeling that deep void inside and the negative voice. I am now 28. Iv'e managed to find a little bit more of a balance between technology and life but I am still depressed and cycle in and out of this. I would look into an addiction though, it is possible to be addicted to electronics (especially gaming and the internet). If you feel like you're agitated and your depression is linked into computer usage you might want to consider that your depression and negativity is linked into an addiction.",1
I have the opposite problem. I eat and eat and eat when depressed. Sometimes when I have bad anxiety I eat though.,0
"very cool accomplishments! a photographer as well, love to see some of your work if you wanna share. at the end of last year my girlfriend of two and a half years left me, i had to move back home with my parents and lost all but one of my friends. but it pushed me to finally come out as trans and get hormone therapy. one year later and i feel like myself for the first time in 22 years. a few months ago i stood up to my shithead boss and quit my job working repossession. i really miss the money but miss slaving away for 80 hours a week and now looking into getting a job dreamed of since i was in highschool. sometimes things really do happen for a reason.",1
I feel the same way. I'm angry and depressed. It takes a lot out of me emotionally to do little things like run errands. I hate interacting with people. They state at me funny and act like I'm scary which makes me angry. It's exhausting.,1
Personally I hate Christmas and all the Christmas spirit crap.,0
I just feel like I don't have a purpose. Like while I need things to survive. The things I need don't need me.,1
I was close to doing this so many times.,1
I'm here. I'll try to help.,1
"I felt this EXACT way when I first went as well. I felt like it was a grilling of my life, and I even tried to lie and say that I'm mostly 100% happy with my life and that I just wish I had more friends and cleaned the house more. YEAH RIGHT. I'm a mess a lot of the time and have so many problems I dont know where to begin. Eventually once I started to know my therapist and dive into the smaller issues, did she really start to open up and I opened up myself as well. Keep going. The first day is the hardest I think",1
One of my old therapists used to tell me that these were still considered suicidal thoughts even though I actively planning to do anything. I always told her it was just wishful thinking. Lol.,1
"My current goal is to outlive everyone that cares about me. It seems like the nicest thing I can do for them, and it also grants me a chance to figure stuff out. All of my self-preservation instincts are driven off of the pain I would cause loved ones if something were to happen to me, in all situations, and that fear is what keeps me going during the worst of it. If you can't do it for yourself, try to carry on for someone you care about.",0
It really is one of the worst feelings. My dog who was my best friend for 6 years was just gone one day when I got home. That was about two years ago and I still miss my buddy,1
"I'm sorry, my friend. I lost my mum too, two years ago. I feel your pain but it'll get better for you, I promise.",1
"You got it all wrong. You should be looking forward to making more of those happy days, if you force yourself to be sad simply because you know you're depressed, you'll never get over it ever. Hang onto those days and strive to make more happy days each month. Depression is fed from negative thought process, let it starve",0
"Everything is pointless, all our feelings are illusions because they are all brain chemicals. I don't see any meaning in life, there is no purpose, no happiness, no satisfaction. Why being happy/wanting to live is the normal quality of a human? Can't depressed be normal too? Is depression real?",0
"What I can say that I can relate somewhat to your situation. Upholding social standard is hard and especially hard is keeping in line with what your family wants from you. You need to be able to find joy in new things, in what you find interesting currently, even if it isn't exactly accepted socially and your family might not like it. It's your life, not your parent's.",1
"Not in the same way - I have a job (and prospects), I have some friends, but I live a life in solitude, since I cannot enjoy spending time with friends or people because it amplifies my depression - and I have no clue why. Maybe because I always feel alone, even when in company which makes me avoid it. So yeah, it's not what I'd call a life worth living and at least somehow related to your struggle.",0
"Back at my old job, I used sick leave.",1
"I think it's more like...suicide IS selfish, but so is asking someone to not commit suicide. So the argument is just kind of invalid because it's merely a question of who gets to be selfish.",0
"Same, well obviosuly I don't know how you feel 100% but I thinks its appropiate to say I can relate to you deeply. Why don't we try distract ourselves, even if its just 5 mins. Listen to a song you like, watch a small video, browse r/eyebleach or even go drink water. Im gonna try and watch something in youtube to at least try and not think about you know what. Wannna try with me? :)",1
"It took me seven years to get a bachelors, and a lot of that was done part time or online. Do it on your schedule. Nobody else's.",1
"Its not silly, its cruel ;-;",0
Except we're all driving on a flat plane,0
Revenge. . . On a life thrown away.,0
"Well yeah, but what about the relatives and the mess?",0
"Hellow, is bad to hear that you're doing bad, I feel kinda the same, don't kill yourself, you're going to die anyway, so try and enjoy as much as you can. I hate how my life is right now, I feel empty and bored with everything/everyone, but.. **I love being alive**, you know, even tho existence itself has no meaning, we can just try and take the best out of it as long as we can.",1
"Happy birthday bud :) Being a Virgo has its perks... this isn't one of them. Always a perfectionist, never happy with anything. I feel you man.. tomorrow is my birthday.",0
same man I feel you,1
"Sounds like apathy to me. I'm guessing you feel kind of lost and without a direction and you just are following the path that you feel is required of you. While apathy is one symptom of depression, it doesn't necessarily mean that you have depression. By no means am I downplaying depression or trying to convince you that nothing is wrong because there isn't any on true definition of depression. I felt like you for a while, just a few small pleasures but nothing really else. For me, it went away after a few months. If you want to talk about it more or anything, feel free to ask anything. My only advice is don't give up now, because if it goes away, you'll regret a lot of things that you stopped caring about.",1
"Really depends on the particular medication. Everyone responds differently as well. I have mostly had bad experiences with antidepressants, but I am not a good example. I know people who really improved while being on them. It is a bit of a gamble and it can take time to find the suitable med for you. I would say it is worth a try though.",1
"Depressed since I was 9, I'm 23 now...I totally feel you, you are not alone. Thankfully life does seem to get better for each year that passes, I deal with the severe depression as it occurs and try to enjoy the times when it's milder. Good luck to you in life.",1
Late at night is pretty much the only time I feel normal. Too bad I waste most of the night on sleep.,1
"As someone who's felt the same, what do you have? And I'm speaking objectively, because I typically don't want to admit that I have what I need when I feel as you do. Not that I'm saying that you do have a lot, but your post doesn't necessarily shed a lot of light on what's going on. It's easy, or it has been for me, at least, to say that I don't know what to live for, in the past. Somebody out there cares, man/woman, small or large. I don't know what your situation is, by your post, but feel free to message me if you want.",1
"You deserve it! No one does! should yourself, though. Try to roll with it instead of beating yourself down more. You could comfort yourself instead and see what that does.",1
Will pray for you my friend. Pray lift these things and issues up to God. Pray without ceasing. Put your faith and trust in the Lord that he would help you overcome these issues and struggles. I wish you the very best. God bless you my friend.,0
"YOU ARE NOT ALONE!!!! You posting here proves that. No matter what give up. There is always a better day, a better year, and a better life. There is so much help waiting for you. Talk it all out here if you need to, we judge and we can all relate. Please rob the world of your life! PM if you need help or need to talk, always willing to!",1
"Exactly. Don't worry OP it will be ok, if one of your conversations got awkward just shrug it off, it doesn't fucking matter. If you see someone alone , go talk to them. If everyone is in a group just be like hey guys what's sup , again don't try to be weird just be yourself. People will accept you I promise. It's best if you try taking to one person, it has much better results so go do your thing",0
"Yea, things go more wrong when happy. Kind of. Really I just get more nervous because I suddenly have that happiness to lose. When Im depressed it is what it is, but when like carrying a bag of money through a bad neighbourhood at let me lose lol. I be happy if not risking something. The risk and fear of losing the happiness, is part of how I feel good. Like, I feel proud that willing to take that risk. If that makes sense? Be careful with music, powerful. I have stuff I listen to because so good at effecting how I feel. Also, your brain releases a lot of chemicals when happy for the first time in a while, if ever had an extreme sugar rush, or done cocaine lol, it can be overwhelming. normal though.",1
"Replace cutting with something else. When you wanna cut do something else. I smoke haha but seriously maybe theres other things that you might enjoy. Before I lost all motivation for anything I used to like running till my body hurt. It releases endorphins and other good stuff. I can vouch, I felt good afterwards.",1
"Depression is a hard fight. I am 29, on meds and I still struggle. All I can add is to start with yourself. Keep a daily routine, like hygiene or reading, find something that allows you to clear your mind and be calm. Go to work or go to school and be yourself. Always find something that can make you laugh. A great sense of humor and a good personality can for real change the way people see you. I had terrible acne as a child and hated how I looked, but as I grew older I gained more friends through my humor. I only really have 2 friends but they are great friends. Quality over quantity and all that jazz. As for being single I too am in the double digit bus. I go from periods of loathing being alone to being numb to being okay with it. My friends and the things that make me laugh help ease that pain.",1
When did you notice you're feeling crappy again?,0
Medication. My panic would feed on itself to the point where I'd have done just about anything to make it stop.,1
Dude don't say that man your family loves you and trust me you do not want cancer,1
