response_post,level
"There are tons of opportunities out there that can help you earn decent money. This includes: website testing, taking surveys, data entry, transcription, virtual assistant, and so on. Can I suggest you something? It's a process to recover from your depression. 1. The first thing you should do is to find out the top three things, basically your skills that you are good at and which can help you in some way for getting online jobs. 2. Make a list of such jobs that you can opt for as per your top three skill-sets. 3. The next thing is to look for free or paid online resources to learn about that job and start applying. I would suggest starting with some easy job that you can find without any trouble. For instance, you can do data entry in the beginning. After a few months, you can start doing transcription work, and then maybe move on to become a virtual assistant. So in this way, you will ultimately start earning a decent earning on your own. I hope this may help you. All the best!",1
True. Not long ago i reached a point where even taking a shower was a battle because of anxiety and depression. Doing the dishes. The laundry. Cooking. Going to do the groceries. All battles with myself. Emprisonned in my own brain. I understand you. Keep up.,1
"Yeah, it's an odd experience and I often get incredibley cynical and judgemental about people and life.",1
the typical easy life of a woman in 2018. Made easy by weak men.,0
I will make it possible,0
"Cutting the topside of my arms hurt and bled but they clotted pretty quickly. Please use a sterile blade if you're going to cut yourself, and don't go any deeper than just the surface skin. Take it from me as someone who has used self-harm, an infection is not the sort of pain that helps with emotional relief! I also recommend other methods, there are plenty out there that can cause some pretty gnarly pain but are far, far safer than cutting. Are there any taps in your house that have overly hot water? Boiling water shouldn't be used as it will scald and is just as prone to infection and other nasties as cutting, so just try clenching a fist under the regular hot water for a few seconds. On the other end of the scale I found the grabing an ice cube and squeezing as tight as I could helped! I thought it would just make my hand feel numb, but it creates a localised, sharp unbearable sensation that works wonders to distract me.",1
Same here. Depression made me into a miserable bitter piece of shit when I used to be humble and kind to everyone.,1
"Yeah, what alak said, for real. God, I wish I had that addiction. How do you get that addiction?",0
"What's done is done, but you can change what you do next. Have you been to see student support? Sometimes if you're unwell they can help give you some special conditions to make studying and exam conditions a little easier and flexible. you still have to do the work but it can take some pressure off so you don't feel like you have to cheat.",0
Aren't we all? It's basically all there is to life.,0
Actually I find myself taking much longer showers when I'm depressed. Sometimes twice in a day. It's the only time I feel relaxed.,1
"Yup, my therapist described this to me as a triangle: Thoughts fuel feelings which fuel our interactions which fuel thoughts. She said that the only way to escape the loop was to break one of the parts. Obviously breaking interactions would just put on a facade, so she suggested breaking either thoughts by changing perception to be more of what she called rational, (through looking at the ups and downs of any situation instead of deciding based just on the downs) or breaking feelings by re-evaluating them using a similar method. &amp;nbsp; I've always unknowingly found myself back in the loop over and over again, but what I would do in your situation would be to look at things objectively, put a self-aware lens over your life, see what you can do to make it better and make choices from there.",1
"People do actually notice the scars, but they dont know how to react. I had a friend who used to cut herself infront of the whole class. I didn't want anything more than just take that razor blade from her and just giver her a hug, but i was too afraid. Funfact: being afraid in this moment started my depression. About a month ago i was in a train and saw someone sitting with scars on their arms and i wanted to go over and talk to them, but i just didn't know what to say so i didn't go over and i didn't talk to them.",1
"Tbh. I find most people are pressured to 'appear' happy. There's this societal idea that people need to find a 'happy life' or that the pursuit of happiness is the most important part of our lives. Which I honestly think is dumb, cause it implies feeling anything else is meaningless. But feeling depressed does not have less meaning than feeling happy. At least that's my thought",0
Do you want to talk about it?  (I realized that sentence kinda sounds sarcastic wasn't meant to be),1
"Depends on the medication, but yes.",0
"I felt the same way at 16 23 now and things are alright. I got through college with a decent degree and got an ok job and my own place and a few good friends. You can get more freedom with time. I promise not special, not super smart or anything just always tried to get through this depression bullshit. So please sell yourself short. Medication can also help a lot if chemically unstable.",1
It's good that you are spending quality time with your grandma. Our grandparents are only with us for so long.,1
"Good, keep it up. I'm glad someone could get help, being around people in similar situations has certainly made me feel at least a little better.",1
You don't sound evil to me. Why do you have such a negative opinion of yourself?,1
"Ugh, tell me about it. Although i've been eating, just a lot less than normal,i still just want to lay here and just forget about everything, but laying down leaves me alone with my thoughts always thinking about what was. I've been trying to keep active to keep my mind on other things. You should give it a shot. Go out to a restaurant or something, just get out.",1
"right there with you, not sure it's a positive or negative to dream literally every time I fall asleep.....",1
Go for a walk or run. Get tired so your body feels like shit. Then your mind will focus on that shit feeling instead of making them up. It works for me,1
"Don't tell yourself that's it's going to be a shitty day. Literally force a smile, beat the thoughts in your head into submission. I read once that people who have terrible sleep can lessen the affects of tiredness by telling themselves they had a good sleep, actually vocally saying to yourself I had a great sleep, and it works. It may not completely erase your sleepy eyes, but it's better than being drowsy all day because you keep dwelling on the shit sleep you had the night before. Placebo.",1
You better with an ax or a sword?,0
No you are not a loser in any way. Admiring your depression shows how strong you are. This is something that is hard to get rid of. Believe me I know. important is that you give up and keep moving forward a strong and special person. I believe in you. Have hope. *hug*,1
"An old girlfriend and I have some sort of connection. We both have depression and similar backgrounds growing up. We are able to talk to each other, understand each other. Better than our respective spouses can understand our depression. The only problem is that I'm still not completely over her. She still has a soft spot for me too but it isn't the same as what I feel. We broke up 35 years ago. &amp;#x200B;",1
"sadness is not the same as depression. And people trip all the time and others laugh, it's no big deal and no one cares beyond that moment. Next time, either make a comment about your legs not working, or bow to everyone, or something like that, or just get on the bus and keep going with your day. Imagine if you were a waiter and dropped some glasses- would you walk right out of the restaurant because people clapped?",1
I'm in your prayers bro. Remember your not alone.,1
"I'm not even my fucking number one. I've tried and then depression steps in, raw physical pain.",1
well it could always be worse lol,0
I'm obsessed with video games and spend a lot of time reading or watching videos about them. Unfortunately my depression keeps me from actually being able to play anything. It sucks so much because now I have nothing to go to when I'm feeling down.,1
"I don't have anything to ask, I just want to let you know I hope you get better soon.",1
"What's special about you is that nobody is ever like you! Your personality, your being, your laugh, the lil things you do when people aren't around you are special",1
"I'm in my 50's and have been struggling with depression since I was a child. In my experience, the teen years were quite difficult, so I would say yes, that it did get better. Until it got worse again. Then better. Then worse. Then better. Many many wonderful things have happened during the good times. And I've survived 100% of my bad times. What I mostly have learned over these decades of illness, is that things always shift, eventually. I rely on docs, meds, therapy, and my spouse in bad times, and basically just ride it out.",1
"Don't worry, I'm stacking my tear t_t",1
You're lucky then. I'm just ugly.,0
I would be keen to know too,1
These meds can take up to three months or longer to start working. Please give up yet.,0
"My mother is an alcoholic too, I know where coming from. be your friend.",1
"I sometimes wish for the same thing. That some random event would end my life for me. Like a drunk driver or a meteor falling from the sky and hitting me. &amp;#x200B; It could happen. Who knows what the future holds? But, if I have to do it myself, so be it. &amp;#x200B; Good luck with no longer feeling this way.",1
Yeah I often wonder if I am just negative/ungrateful/lazy/etc or if there really is a legit label for it. Constant battle in my head.,1
Absolutely. I always dream from the POV of someone else (usually imaginary). Reading novels and trying to forget reality feels better too.,0
"I had some major shit go on 2 years ago, mother with a brain tumor, my aunt was selling the place, needed to move, I couldn't function enough to clear her place out and find a place to live. I ended up packing up what I could fit in my car along with my dog and went camping for 3 months. I needed that.",1
Why not? Are depressed people not supposed to feel a little hope at times?,0
"that be nice? I am in the same boat...for about the last 8 years it just keeps getting worse. I am sorry you are going through it too...I am not real hopeful about it getting better for me anytime soon, but I really hope it does for you. it strange that we can believe it can for someone else, a complete stranger on the internet, but not for ourselves? If not happiness, I hope you can find at least some peace and comfort in 2019.",1
"Yeah, with you. longing for the next sincere laugh or anything that I find funny anymore or someone who will play that game with me in real life..",1
"No one's brave for killing themselves. It's the *fear* of living that drives them to end their lives. But something inside you wants to live. If that wasn't true, you'd be dead by now. I'm glad you're still here, and I hope one day you can be too :)",1
"This is so fucking relatable... In every aspect of my life. I know my words won't change anything, but there are others who feel the same. I hope you find your way, OP.",1
"Whenever my one friend who I text is taking too long to reply or has more attitude than usual, I assume that she's either busy talking with people she likes more or just gets fed up talking to me. When my neighborhood friends haven't come to hang out for a while, my automatic thoughts are that they're at another friend's house or at a party having the time of their lives while I sit in my house doing nothing. And at family dinners and birthdays where everyone's happy and getting along, I constantly get the most dark and sickening thoughts in my head that I avoid letting out by ignoring everyone around me. Life sucks :(",0
"and when you cannot even trust yourself, that is when you are the lowest..",0
"Hey there you seem to be going through something, care to share?",1
"Have you tried telling them to get help, therapist, medication, or hospital. You could always call the suicide hotline. I called them when my friend was about to kill herself and it was very helpful.",0
"As long as you arent overdosing there is no reason to get rid of them. Keep them for a rainy day, or if things get consistently worse",0
Is there any chance of reconsideration?,0
"I try too but often erase what I say before posting, as if I know all the answers when I'm here for help too. I feel terrible about staying silent but when its serious as life and death I can never post out of fear..",1
"Be strong my friend, Everytime I come in here, I don't feel so alone. This may sound selfish, but it's good for me to know that there's people out there that feels the pain that I feel every single day. Anyway, have a great day, my friends.",1
"I dunno man, I over come either even with a ton of meds. It really depends on the person.",0
"As a kid there was a brief window of time where I wasn't being bullied as much as I used to, and I had a personality. I made up jokes on the spot, would talk to anyone, was interested in loads of things. Then, something happened and I seemed to just switch off again. It might've been all the rumours that I'd be beaten up by gangs of people every single day in the next school, because I didn't act a certain way. It might've been the continued bullying in that school. Soon enough I was a completely hollow shell once again.",1
Right. Literally wishing to just die in some random accident and it happens to someone who doesn't deserve it. Happy life living people who definitely didn't want to die.,1
"I usually revert to things I loved doing before the depression, like getting on the computer and playing Rollercoaster Tycoon.",1
"Not sure if i want to know , probably take me down to the next level of my depression .",0
"Same boat, man. Seeing happy couples, especially my friends, is like being stabbed in the gut.",1
i wish i had someone like that. i've never been close friends with a girl before and sometimes i doubt whether i'll ever get one let alone a girlfriend,0
I spent entire life alone,1
sorry to hear. :( is this an ongoing thing or does it come in phases? how does being high help?,1
"I know. I don't get it either. If most people were anything like me, human civilization would crumble - would never have started.",1
"Yup. In my experience sertraline was more intense than (es)citalopram the first few days and I started slow at like 12.5mg. It's really the first week - actually about the first 4 days - effect. The thing that requires the black box warning because it's a surprise if no one tells you to expect it (and not everyone gets it so powerfully). If it's too intense talk to your doctor about cutting back and moving up slower (I've settled on 50mg and that was after titrating up). Try splitting it up into at least two doses so it doesn't all hit you at once - sertraline's got a relatively short serum life and I'm preferring a morning and afternoon dose. ... and during this 'jittery' period try to take it at least 4 hours before bed so you'll have a shot at getting some proper sleep. It gets a *lot* more boring (but still potentially helpful) once your body adapts! Right now all sorts of stuff is going on with your serotonin and it's pretty much the 'psychedelic' part. Once your system adjusts the idea is that the drug is holding a 'buffer' of serotonin in the synapses so it's there when you need it for more even moods and less discomfort, but until that settles down it can be pretty trippy and stimulating (especially with sertraline that has a nice extra dopamine stimulatory effect, which is pretty helpful offsetting some of the more annoying SSRI side effects in the longer term). So if you feel like you're going to jump out of your skin now - yeah, that's normal, and it passes in about those 4-7 days (for me, anyway). Also heads-up that.. yeah, with sertraline, those days included a lot of nausea and (ahem) intense GI effects for me too - that passes too.",1
"Its just another day, but another day of triumph because you're still here. It may seem insignifigant, but you are fighting a very difficult war, and today you won the battle. Stay strong OP. Much love.",1
"No don't do that, I live there.",0
come back whenever ur ready. I took two years off b/c of depression and I came back this semester. Honestly its hard af I almost dropped out again but im pushing through...,1
"Fuck happiness, I'm kind of OK not being suicidal. Boring is good",0
"I'm on the same meds, and I just wanted to ask how long it took for you to start feeling the effects.",0
"I always find that crying feels like liquid self pity, but that's probably just cause i'm an asshole to myself a lot.",0
"Wow, looking through your post history makes this hit even harder. :\",0
"Well I can say that I think it's really good that it gets better throughout the day. For me it's the opposite, my mornings are bleh. As the day goes on into the night I feel better, and before bed time I feel depressed. I think everyone is just different and maybe getting your day started gets rid of some mental worries and anticipation",1
Same here. You can tell just by looking at me.,1
"Mental illness can be overpowering . You may feel like you have no control. But please try to hold on , don't give up on yourself .",1
I am sort of in a similar boat. There are lots of people around me but it still feels like entirely alone. prepared to spend most wonderful time of the getting drunk everyday until school starts again. And then starting another draining semester.,1
"I thought I was alone in this, but yeah, sometimes the self hatred/pity/sadness becomes so overwhelming I stop in place and feel like I can't move for any amount of time, be it 10 seconds, or 10 minutes.",1
"This is exactly what I do whenever someone asks something like do you like to How am I supposed to answer that? I like to do anything, I just sit at home and think about how much I hate myself. But I say that because not the answer, so I just make something up.",1
"I do, because no one can change how i feel anyway.",1
the two biggest signs for me are when when i start neglecting my appearance and stop cleaning my room.,1
i'd say that i would have overcame any suicidal thoughts because of my fears ;),1
"Run really fast for 30secs should warm you up haha :p Hi, how are you? :)",0
"I'm pretty upset myself haha, but let's talk about you, you wanna talk about yourself? what's been going on?",1
"Just wait, the sex robots are coming.",0
"You hate yourself? But who is yourself, what do you hate?",0
"This is me every day...I drive 17 miles down a windy rural road fully lined with large hundred year old trees on my way home. People die all the time on my road. I help but feel like speeding and steering into every tree as I come around a sharp corner... my car is a 2014 Jetta sport...I think die if I crash in it... I stand the thought of not dying all the way. Or just being brain dead. I just take 25 mgs promethazine, 30 mgs Cyclobenzaprine and 75 mgs vyvanse every day just to try to feel something other than the urge of dying...",1
"they say wherever someone is still thinking of you, that place is your home -jiraiya (naruto)",0
"I've come to help you. But I can't do much. Encouragement- they're all lies. I can understand how you feel because I am exactly in your shoes. If I kill myself I'm scared that I'll go to hell. So I'm stuck. But I can assure you that you are not alone. And if you want, you just got to hold on.",1
"There is always help. Please PM me, and we can talk.",1
"I bought my self kfc, no one is doing anything, or i should say i was invited to nothing. Im sorry to hear that im sure she loves you or why else would you still be living with her. if you just went over to visit im unsure why youd put your self threw that.",1
"Yep! I love watching vlogs on youtube because it feels like I have a friend with me, telling me about their day or week. I also just love background noise, and it honestly does help me feel less lonely. I think it's a pretty common thing, my dad isn't depressed either and he has to have a TV on when he is by himself or else he feels weird.",1
"In my experience, the emptiness is worse. I eventually just broke down and cried for a month and it was such a relief after years of not feeling anything.",1
"Happy birthday, you should proud that you've made it another year. I'm proud of you haha",1
Lots and lots of alcohol lmfao,0
"I keep hearing about this gym you speak of. Works, huh?",0
"I feel the same, I feel as if I was born defective.",1
"Do you feel bad after drinking? If not, why should you give it up? Also, does it interact with medicines you are taking?",0
"Danny Devito seems to be carrying on just fine. Head up OP, regardless of how you feel and what you think, people always have it worse. Regardless, all in this together",1
I know how you feel. I think the same thing alot,1
"I guess kind of our fault, but at the same time I think we desperately wish we could be better. Sometimes we really physically and emotionally can not be better. Stay strong, not alone.",1
Let's start from the beginning. Is there anything triggering this currently that you can think of? How long have you felt this way?,0
My plan is to have enough money to start a cocaine and hookers lifestyle until I die of hepatitis C,0
Hopefully just right around the corner,1
"thanks, friend. do the same for you.",1
"Having been abandoned by close family when I was young, I guess become preconditioned to expect people to eventually always do the same. It hurts because it means I can never truly get close to people, or if I do I get too clingy making sure they never leave me. a vicious cycle.",1
Just do it. Don't think about it. Everything will be fine. &amp;#x200B;,1
Sometimes if I see a bridge or I'm high up I think I could jump and it'd all be over. Your miserable existence would cease.. but I'm too afraid to do it.. and the sad part is that I'm also too weak to live.,0
"Yep, this is pretty common. Usually when you've been depressed for a long time, it starts to become a part of your identity. I assume normal people feel a range of unpredictable emotions throughout the day, but the state of depression is pretty unchanging and there's a comfort that comes from feeling sad/numb/apathetic all day/week/month. I used to fight my depression and look for things to make me happy...when I realized it was all meaningless, I gave into my depression and it's now my closest friend. As sick as it sounds, I wouldn't want to lose it.",1
"What is it about telling a friend about your struggles with depression that makes you feel like they will react adversely? If they are a trusted friend, they will care and listen to you and be supportive of you. The benefits to discussing this with a trusted friend is they can help you get the help you need and be there for you in the ups and downs. Everyone has had depression, just for some it can be more severe, longer, and more disruptive to one's life. Try to get them to relate by asking about their moments of depression. A good way to discuss this with them is in a quiet place over coffee or food. All the best to you.",1
Huh. Good to think about.,0
Have you been smoking since long?,0
"If they work or they give you side effects, then you can try something else. You always have a say in what you take, and can always say no or tell your doctor what side effects concern you the most and they will work with you on what medications to try based on that. If your doctor one you feel you can talk to easily, maybe try a different one. great that taking a step towards taking care of yourself. I hope it works out and you feel a bit better over time. Also, I started trying to chart my moods and that can sometimes help me reflect on if medicine is helping or not. Best of luck!",1
"Yeah, not me, dog. I overthink about worthless and easy tasks while not even thinking about demanding ones.",0
"You realize people's instagram feeds are manufactured to just show the good side of things right? People only show when they're happy or when they appear to be happy, but in reality they might be just as miserable as you. It's all fake.",1
"Hey, I know how you feel. Sometimes it's hard to handle daily responsibilities when you're depressed. Everyone fucks up dude. (A practice that is helpful albeit uncomfortable is closing my eyes and breathing, imagining the place that I dread returning to, and picturing myself sitting in there, breathing and at peace. Then I zoom out to the building and picture all the rooms filled with all the other students.. Then I zoom out and picture the exterior... I zoom out and imagine the city view, then the state, then the country, then the hemisphere, then the whole planet, suspended in the I stay there and I just watch it spin slowly. And This puts into perspective that my mistake cannot defeat me.)  I flunked out of college my freshman year and still haven't had the courage to go back, so I commend you for trying again.  And as unsolicited as this is, I gotta say I disagree with the polarizing statement that there isn't anything you can do. You can own your mistake, which you already have. You can brush yourself off and see the mistake in the context of the rest of your life (which is priceless and you are worth so much.) And you can try to do better tomorrow. You are only human. Try and keep your chin up, buddy. (edit* for clarity)",1
