response_post,level
I believe that is something that must be said. Could be a side effect of some medication,0
All the time. Ive made hundreds of impulsive decisions and burned so many bridges based on this feeling.,1
"i know, right? how dare people have fun in their spare time.",1
"I feel you. Have you thought about speaking to a therapist or call a depression hotline? I'm not sure where you are living, but those calls are usually free and the people on the other end are pretty great at listening and coming up with helpful strategies. Hang in there.",1
"I've never even had a friendship, much less have one fade. :(",1
Homosexuality hasn't been considered a disease for awhile now O_o,0
"only 20 and it looks to me that life really get better, but our ability to cope with what life throws at us is what gets better",0
"it's just one of those normal things in life, we'll keep on trying and we'll keep on failing. The reason success feels good is because you work for it. Don't let disappointment get to you, look at it this way, being disappointment means you know you could've done better. Your time &amp; effort isn't wasted as long as you learn from what you did. Just keep on. am I making sense? sorry for rambling",1
"Happy Birthday! Just remember, the next one will be better.",1
Fuck her. You need her.,1
"really sorry going through this. basically going through the same thing right now. Let me know if you ever wanna chat. Things will get better eventually, I hope.",1
"Yeah I feel that way too. I tell people I feel crap, and then they feel sad because I'm down.",1
"i suggest consulting a doctor before working your way off it though. doing it without proper planning might actually cause really bad physical side effects, or even increase the risk of developing suicidal thoughts. its not easy man... but i really hope one day manage to be completely off it :-)",1
why is life painful for you . you have someone who loves you ? is there voices saying things to you ?,0
"Just another day to throw away. Typically with an extra helping of faked emotions and facial expressions to keep my friends and family under the impression that I'm okay on that day, when it's the day I wish didn't happen. It's fucking exhausting",1
"you forgot, you still have yourself. you're not worthless just because you don't have any money. don't stay for your brothers. stay for yourself. this sounds but there is stuff worth staying for. the shitty truth is if we kill ourselves, people mourn for a day, then move on and forget us. our life briefly becomes a public spectacle. people spout shit like ohh what a sweet person, shame they died. they won't say that they were the ones who ignored us when we were alive and suffering. THEY WILL FORGET YOU. so stay the fuck alive, and make them notice you because you deserve to be noticed. worthlessness usually stems from lack of accomplishment. if that applies to you, start learning or doing something. anything that interests you. just give it your all. but don't die just yet. you will, eventually, so why hurry. so for now, look in the mirror every time you feel you're alone, and remind yourself you're not.",1
Tell me about it. Good luck in your search!,0
This is great to read :) Good luck with your other midterms!,1
Yes. I experience this very frequently. Some days I'll wake up feeling fairly good (hardly ever ecstatic though) and others I want to stay inside the whole day and worse.,1
"It absolutely is, but if you're desperate for self-harm, I'd still advise against sleep deprivation as it will make your depression orders of magnitude worse.",1
"Sorry for your loss, but don't feel guilty, there's probably a reason why you feel that way. Also, your feelings might clear with time.",1
Why do you feel shittier after?,0
"I was on it very briefly before getting taken off of it due to debilitating depression along with suicidal thoughts (as a side effect), but yes, I did get a few terrible headaches.",1
I wish i had the courage to end the suffering too.,1
"I know how you feel. I am also cursed to live this life, until the day I die.",1
"Remember this. In order to find light, you must be surrounded by darkness. Whatever you're going through, remember that you can overcome it!",1
That last sentence really got me,1
"Do you mean your bad days feel worse or do you mean you feel bad and good at the same time? Ever since this thing started for me I had fluctuations over the course of the day, days and weeks, where I would have lethargy, tiredness and depression in the mornings for example and then good feelings and even excitement and a lot of energy in the evenings. Also I have very good days/ weeks and suddenly it hits me again. Did you have constant depression and how bad was it?",1
I was one year in collage but I realize that I didn't like how we studied there. I dicided I would try to studied something related with airplanes because I always love it. Now I have ended my studies and I'm going to do an internship in an airline. The most important thing is doing what you love.,1
"i know if it could be considered a stimulant, but i take sertraline for my depression and i get fair results. I also used to take vyvanse in combination with sertraline but i must warn against it. It usually left me numb and unable to enjoy anything.",1
I feel the same way and I guess kind of teach myself to just breakdown and cry when I get too overwhelmed with those kinds of feelings,1
If you want someone to talk to I will be here. You can PM me if you want,1
"Lmao, I love it when my asshole father tells me this. Yeah, it really helps. **Like I didn't try THAT for the past 4 years.**",1
"Hi friend! :) I'm really sorry you're in such pain :( sometimes the people we have around us can't see the pain we're in because they don't want to (they may see it, not know how to help us, and are afraid to because it may cause them pain). This may seem like useless advice, but it can greatly help if you tell the other people exactly how you're feeling and ask them to try and help you. Nobody will ever be inside your head and able to experience exactly what you are feeling, but by talking to them and letting them know, you can help them to understand you. Sometimes we have to do the hardest part of reaching out ourselves. I had to tell my best friend I was feeling suicidal, but by telling her she helped me turn my life around. She just didn't realise. It's never easy to do, but I can promise you that you are so much stronger than you know, and there are always people willing to listen and to try to understand what you're going through. Lastly, I hope you don't die. Not until you've been able to live the life that you want, the life that you deserve to have. I'm sending you love and luck.",1
I take melatonin and that works,1
This is really true. I showed that i cared about 2 friends at school (2 girls) and now they think they can make me do everything. It makes me really sad because i feel being used by everyone,1
I'm around if you need someone to chat with. I'm sorry you're feeling sad. Sometimes it's such a painful and unbearable feeling.,1
Same honestly. Half the time I feel like overreacting and because of that I feel like a little bitch which brings me down more.,1
I feel like this all the time and I am never sure what I am looking for. I really wish I had a passion in life like some people have. Sadly I have not found it yet. I never felt that strongly about anything. Maybe I need girlfriend.Maybe I just need more friends. Maybe I need a different job.Maybe I need to to work things out with my farther. Or maybe I just need to be able to really talk to someone.,1
Why cant you get it treated? (excuse my ignorance),0
summed up my feelings in a few sentences. Every. Single. Waking moment. Is shit. Hobbies help. Exercise help. Talking to friends is now a chore. literally all shit.,1
"That has to be tough. It's different strokes for different folks of course but I might have a suggestion. I find my depression tends to be racing negative thoughts. My understanding is that there are two default brain modes, one is random thought, day dreaming for example, and the other is processing. So you need to switch from day dreaming to processing, and that is hard for everyone. Start with meditation. Close your eyes for 5min and focus on your breathing. If your thoughts drift from breathing, then shut it down n snap back to breathing. Don't get emotional, just stay calm and focus on breathing. When finished, move everything that is a distraction away from you. No phone, no internet if possible, just clear that shit away and start studying as if it is your breathing. This focus is just like a muscle and the more you flex the stronger it will become. Don't expect to focus for hours on end, but try to catch yourself when you drift and get back to that focus. Also make studying fun, or less boring. Take notes, highlight pages, repeat the things you read. Most importantly, try telling a story with what you are learning. It's a strong method for memorization. People with ordinary memories use stories and codes to memorize full decks of cards in minutes. Good luck!",1
Legit one of the best pieces of advice seen on this sub in a long time. Thanks bro.,0
I've been on leave for 10 weeks from work.,1
Hopefully they can help you.,1
"Happens to me too, you're probably just sleep deprived, lack of sleep is known to cause hallucinations/illusions.",1
"Hey, what's up? In general, it is the happiest time of year, but on an individual level, happiness can be at any level, any time of year.",0
"Why did you decide on that? I'm sure you're an incredible person, please don't kill yourself, have you talked to anyone about this?",1
Same ! +Crying every now and then.,1
I feel this way too. It's like we've been branded so we can never forget we belong to despair.,1
Anything outside helps me. I like to look at the stars at night..,1
Why do so many of us feel this way.,0
"this has been a big one for me. I used to always listen to music, now I at all. Trying to force myself to listen to music now. I think because I was in a better place when I listened to music, so now I just miss the person I was, and avoid any reminders of that version of me.",1
"Having a presention in 15 hours and not preparing for it. and in the next 36 hours of now, an exam in which i have no studied for.",1
It may suck in hindsight. But her hair will grow back and you'll have a story to tell. It happens. You have to look at kids as things of wonder. They learn the hard way. They always will. Just be happy that they're alive to make those mistakes. Love them when they make mistakes. You're their to protect them,1
"Exercise has always helped when I am as you said. If you would do anything to feel better, then muster everything you have for high intensity exercise. At least 45 minutes for three time per week. I get it, the last thing you want to do is exercise, but if you will do anything to get out of it, just do it.",1
Care to talk? Feel free to message me any time.,1
not me. i hate cold.,0
"I have to be honest with you, because it's very important: I believe friends are very important. But it's extremely hard to make friends, I know. But talking to people about how you feel helps alot, it does with me. It gives me purpose, dreams and hope. Friends can come from anywhere at any time. If you ever want to let off some steam, bounce something off another person or seek advice, never hesitate to write to me. I'm your friend, and I'll never let anything happen to you, if I can help it. Please talk to me if you need it, it can save lives, in more ways than you'd think. Have a very merry Christmas, know you are not alone.",1
Me too..depression clouds our judgment. It gets really hard to think about things clearly. Hate this feeling but it won't go away yet.,1
"I try to do that at least once a week. If its too cold outside then i just lay on a carpet, or take a really long bath.",1
Doug Stanhope has a bit about it,0
"Although you did express that thought and feeling in a clear and concise manner. Not sure if that helps but hey, it's the best I've got right now.",0
ive lost hope im just numb now,1
There are many services that local and state governments provide to help people such as yourself find work. The cool thing is they are totally free and they can provide a support system and will work with you to find a job that works for you! I would suggest looking online for these services and sending your information to them. Stay strong and I love you!!,1
I feel alone also. Although people want to date me I always feel they are just using me for my appearance and do not care about anything I have to say or care about me irl,1
"Take small steps. Indulge in little things that make you happy (or at least used to make you happy!), such as food, or some nice tea. When you consume those, try to focus on the taste, on the pleasant feelings. It's just one example, it can be something else. A walk around the neighborhood maybe. A nice bath. Etc. Generally speaking, be kind to yourself.",0
"Yeah, I have to agree, she sounds like an absolute moron. In some ways, I realise this isn't gonna be easy for you to believe yourself, but it may even be helpful that this has come out because it sounds like she just wouldn't have been a reliable friend. There are other (much better) people out there. Just try not to actively worry about it too much, or really try and find someone, just let it happen if it happens, and if not, don't fret about it.",1
Please don't. Its just not right choice make. There is always something that can be done other than that.,1
Depression is a disorder that you ask for,0
"i read a thing a while back... to paraphrase (badly): Most people think that depressed people are bad at regulating their emotions. But actually, depressed people are great at regulating their emotions; they just always regulate them toward depression. ...When i first read this, i was sitting alone in the dark at 2am listening to Elliot Smith. So, it rang true. It's super hard to do, but if you can force yourself to change your habits (even slightly), your brain actually physically changes with practice.",0
"Hang in there. Spontaneous Remission blesses like an angel. When she comes, there will be new people you love and love you in return. Stick it out. You got this.",1
"I remember when I was in a deep stage of depression I always begged my mother to let me stay home. Even when she drove me to school, I would catch a bus to the shops and ditch school. (Never got caught hehe) Anyway, I just felt so.. bored of school and so sick of all the shit that went down there. Instead, I decided to live my life, have fun, sleep, ditch school or do whatever and just live the life as I wanted to. If you cant find motivation in one thing, than find motivation in another. After all we're all gonna die one day, live your life as you want.",1
She might know and just not be interested. You can't force it.,0
The fires we start burn ourselves sometimes.,0
"Everyone die. Maybe you will die from lung cancer too. Its LIFE. For girl you can fix this easy. Explain what you feel about her. And parents always mad in every family, like my mom",1
"Yeah, LDRs sure have their challenges. Anything in particular you'd like to talk about? I've been in a long distance relationship with my girlfriend for the last couple of years so I might be able to offer some insight or at least my own opinion on them. It won't give you any answers or solutions but it might help to have a different perspective.",1
Odesza - Across The Room,0
How so are you a burden?,0
"I was on Lexapro and Wellbutrin for the longest time and didn't have any bad side effects, but it definitely didn't help me as much as I'd hoped. It did get me from I can't leave my bed to I guess I can function occasionally on a good day. I'm no longer on the Lexapro but the Wellbutrin has stuck with me for a while, so. It went well for me; Hope it goes well for you!",1
You can check and see if your insurance will cover it,0
"Either a therapist or your closest friend, one you can trust.",0
"This happens to me. Whenever this happens to me, I just count to ten, I don't know why. then I remember my childhood when I was about 5 or 6, playing with toys. Then that makes me feel better.",1
Make the most of the upswing :),0
I am in the same boat friend.,1
"I can relate, it sucks so bad because you know it isn't something you can ever change. The only thing you can do is change the skin and hair, but the actual face stays the same. Regarding the rest of my body though I started working out and that helped a lot. If weight is the problem start small and work your way up, or down I guess.",1
reacted harshly to some people not messaging back when I know out with other friends and just trying to hang. A lot of people just get caught up and forget or just moved on with their,1
Life is what YOU make it!... Happiness comes from inside,0
Are you telling people you want a relationship? Or you want sex? As people find it hard to confuse the two.,0
I get where you are coming from. I don't feel cold. I feel hollow and my insides are black.,1
At least you have that going,0
"Sometimes. Specifically the spectator thing, it's a depersonalization/derealization thing I think",0
"i remember a foggy memory of saying i want to kill myself in my native language to my sister, of course i was like 7 or 8, or 9 too foggy, anyways i had no idea it meant that, i meant it like, no body notices me.. like a ghost.. thinking back i wasnt good at my langauge. but on the serious note near grade 11, probably went like if i was dead, i'd be too dead to care then i went back to realilty and i was like... what the hell, no, i do care, i won't finish one piece.",1
I have never been in love but i did like someone that like me back. The feeling lasted after we stopped communication about 3 months and i was over it,1
I'm in a somewhat similar position. I love my bf more than anything.. but my family issues and a big issue with a dog of mine is causing him to be depressed and not enjoy his life the way he should be... he tells me this... I solved the family issue.. but the only way to solve to dog issue involves me putting him down.. and I cant do it.. I just cant. I'm starting to think my only other option is just to leave him so he can fully enjoy his life the way he deserves to... n the thought of not being with him makes me want to die... Its devastating.... I know what you're going through... I'm bouncing between anxiety and depression... I guess I should just leave though...,1
"I hate that I usually succumb to the crippling overwhelm that often accompanies me trying to deal with the seemingly insurmountable [logistically, tangible, financial, and medical] things I must deal with...... as the clock ticks.....",1
"Social media is highlight reel! Nobody ever broadcasts the shitty behind-the-scenes stuff. If it really bothers you, which it sounds like it does, maybe take a step back and either reduce or stop using social media. have to be permanent, but it will help you keep your space safe so other people influencing your thoughts in a negative way. Hand in pants is a really great way to relax! No shame in that game. Sometimes when I feel sad I lay on my deck with my hand in my pants so at least sad in the sunshine.",1
Sometimes I do laugh but upon realizing on what situation I am laughing I am again sad.,1
I am not good/smart/witty enough to interact with others. I think it's best for everyone if I don't waste their time. I seem to have the uncanny knack for ruining everything I touch.,1
be I just went through this. Wound up breaking it off with my BF of 5 years for lack of attention among other things.. pm me if you ever want to talk.,1
"I would say plan around your depression. You gotta give yourself more time to do stuff because there will be days where you just do work. If on average you give yourself 2 weeks to do a paper, give yourself 3 weeks and push yourself to work when you have good days. Know that going to be tiring to try to work as soon as your depression temporarily lifts and just take things in small increments. Write a paragraph a day for 3 weeks and or write two paragraphs when you miss a day due to depression and voila! Same results, different pace, depression included and worked around. Practice self care and indulge in the fee things that make you feel okay. stay in your dorm/apartment constantly. Seriously, even if you go to the library for a few hours a day, it helps with isolation. If you like to write, start roleplays with people on geeking or rolemance and reply when you need a break from academic writing. Otherwise indulge in low energy hobbies. And try to eat 2 meals a day even when you feel like it. It makes a difference. Overall, the transition is going to be rough and even more rough for you because of depression so try not to get stuck in a loop of bad habits. Break your routine if not making you feel good and professors are more understanding than not about late assignments and group projects. Be candid with them. Tell them you have the disability accommodations et but working on them. Good luck!!!",1
Good idea. Don't let people treat you like shit and step all over you. You don't need people like that in your life. I'm still kinda passive but I've been trying to have more respect for myself.,1
"Remember that eventually you won't cry, and that you woke up today to experience another day of life. Maybe it wasn't the best day, but tomorrow is a brand new one, and it's going to be ok, whether I'm talking about tomorrow or in an hour or a week, it will be ok. I'm really sorry you are feeling down.",1
"I feel this pretty frequently, although lately it's evolved to wanting to die. It's such a weird feeling to have though, not wanting to be alive or dead.",1
I feel the same. On my lucky days i just happen not to think about it too much. Other days it's just there the entire time. It's tiring.,1
"At least you want to help people! Some love hurting people or just ignoring them, you care and the most important thing.",1
"What's worse is I'm making myself look even uglier because I've stopped caring, which I realise *is* actually worse. People judge me *even harsher*. I'm trying to be okay with being unattractive though. Plenty of people are and they seem to get on fine with life, even if they don't get a partner or whatever.",1
Don't do it. Tell me your story! I'd love to hear.,1
Maybe just around shitty people. I hope you can still make it out of this alive though. at least one person that cares.,1
"I almost broke down crying just then for literally no reason. All of a sudden I started feeling anxiety - had to get up and walk around, knot in my chest, felt like a panic. Was super fucking close to texting my ex, only reason I didn't is because i know it would make me feel fucking shittier",1
like standing behind a glass wall with all of your dreams ahead of you. I know how it feels.,1
Might be a good idea to avoid them for now. Good job on doing your best.,0
"I can appreciate the small things more the smaller and sadder my life gets. A simple hand on my arm in a moment of need means the world to me. And god, it's a beautiful world sometimes. So beautiful it brings me to tears sometimes. Yeah, I'm depressed, lol. :p",1
"As long as your voice, good. Otherwise, this whole class of drugs unfortunately named antipsychotic. Might wanna see a doc..",0
I feel that way often when I go out by myself without my husband or mom with me. So you're not alone. My fear is a combination of the shit my parents told me as a kid and my obsession with crime television. It's a good day when I can go out by myself and be calm.,1
"telling people i love them when i really don't. I just really need closeness and when someone finally gets closer to me, i immediately feel like i'm in love even though we would never in a million years fit together",1
Are you afraid they will critizise you?,0
"I was diagnosed with it when I was 15, and I am 22 now. For my antidepressant, I tried lexapro ( which i stopped taking; because, it made my dick stop working), and wellbutrin.. which was alright. My antipsychotic was risperidone.. which I honestly am still dealing with a side affect of it till this day. I'll be honest, I took those combination of drugs for like 2.5 years, and just stopped. I learned how to deal with the symptoms a lot better than I did from years prior.. looking back.. thst could've gone poorly. I'd recommend being open in discussion with your psychiatrist about the effects these drugs are having on your body and your mood. There are quite a few drug combinations for this type of diagnosis, and it would be wise to work dilligently with your psychiatrist until you find the combination for you. Don't be afraid of them changing your meds. They aren't work anyway, so you may as well be open to working with professionals to find something that works for you and your body. I'd also recommend to try being aware as possible if the symptoms, the triggers for those symptoms, and look to grow from them even while on these medications. Keep a close eye out for unwanted side effects. A lot of the medicines they may try to prescribe would require regular schedules blood work. I'll be honest, I did the irresponsible thing and ended up just not taking them. I got tired of taking medicine at that point; because, I had been taking it all my life. Whether it was for childhood epilepsy, ADHD, depression, and the last diagnosis cyclothymia. Was hospitalized twice before I got the cyclothymia diagnosis, and it was pretty bad at one point, and looking back.. I'm really lucky I didn't mess myself up by just stopping cold turkey. Work with your psychiatrist and maybe even work with a therapist if you can. Do all you can do to find the proper treatment, and YOU WILL BE OKAY. You are not",1
